{
  "id": "451-heath",
  "property": {
    "address_line1": "451 Heath Place",
    "unit": "Apt 2",
    "city": "Hackensack",
    "state": "NJ",
    "zip": "07601",
    "county": "Bergen County",
    "rent": 1925,
    "bedrooms": 1,
    "bathrooms": 1,
    "sqft": 663,
    "year_built": 1950,
    "property_type": "Condominium",
    "style": "Garden / 2nd Floor Walk-Up",
    "floor": "2nd floor walk-up",
    "available": "Available June 1st",
    "offer": "No Realtor Fee - Move In Ready June 1st",
    "description_paragraphs": [
      "Welcome to 451 Heath Place, Apt 2 - a bright, garden-style 1-bedroom condo tucked into a quiet courtyard setting in Hackensack, NJ. Step inside and head up the private staircase to your sun-filled retreat on the second floor.",
      "The open floor plan makes excellent use of 663 square feet - a large, light-filled living and dining area flows naturally through the space. The updated kitchen features new flooring, fresh countertops, and a brand-new refrigerator. The bedroom comfortably fits a king-size bed, and additional furniture is available on request.",
      "Heat, hot water, and parking are all included in rent. Move in knowing your biggest utility costs are covered - rare for Bergen County. Need to move in sooner? The unit can be ready as early as May 15th - reach out and we'll work something out."
    ],
    "chips": [
      "Heat Included",
      "Hot Water Included",
      "Parking Included",
      "Courtyard Setting",
      "Garden Style",
      "Open Floor Plan",
      "2nd Floor Walk-Up",
      "Pets Considered",
      "Built 1950"
    ],
    "features": [
      {
        "name": "Heat Included",
        "description": "Natural gas radiator heat - no winter utility surprises."
      },
      {
        "name": "Hot Water Included",
        "description": "Hot water covered - one less bill to think about."
      },
      {
        "name": "Parking Included",
        "description": "Your own dedicated spot - no permit stress."
      },
      {
        "name": "Private Walk-Up",
        "description": "Your own staircase entrance - garden-style privacy."
      },
      {
        "name": "Updated Kitchen",
        "description": "New floors, new countertops, brand-new refrigerator."
      },
      {
        "name": "Furnished Option",
        "description": "King bed in bedroom plus living room furniture available."
      },
      {
        "name": "Pets Considered",
        "description": "Pets welcome on a case-by-case basis - ask us."
      },
      {
        "name": "Courtyard Setting",
        "description": "Quiet, private community with serene outdoor space."
      }
    ],
    "details": [
      { "key": "Monthly Rent", "value": "$1,925" },
      { "key": "Square Footage", "value": "663 sq ft" },
      { "key": "Year Built", "value": "1950" },
      { "key": "Property Type", "value": "Condominium" },
      { "key": "Utilities Included", "value": "Heat + Hot Water" },
      { "key": "Style", "value": "Garden / Walk-Up" }
    ],
    "neighborhood": [
      {
        "name": "NYC Access",
        "description": "Bus and train connections to Midtown Manhattan."
      },
      {
        "name": "Hackensack Univ. Medical Center",
        "description": "Top-ranked hospital minutes away."
      },
      {
        "name": "Shopping and Dining",
        "description": "Restaurants, grocery, and retail nearby."
      },
      {
        "name": "Public Schools",
        "description": "Hackensack public schools in close proximity."
      },
      {
        "name": "Quiet Residential Street",
        "description": "Courtyard building in a calm neighborhood."
      }
    ],
    "map_query": "451+Heath+Place+Hackensack+NJ+07601",
    "hero_alt": "451 Heath Place interior"
  },
  "agent": {
    "name": "Roosevelt Hall",
    "title": "REALTOR",
    "brokerage": "Coldwell Banker Realty",
    "office_address": "50 Broadway, Hillsdale, NJ 07642",
    "mobile": "(201) 280-6333",
    "office": "(201) 599-1100",
    "profile_url": "https://www.realtor.com/realestateagents/5673e76b89a689010069dbc1"
  },
  "site": {
    "lead_email": "elombe@swftstudios.com",
    "booking_proxy_url": "",
    "airtable_base_id": "appx3jGQIAp1lzwW0",
    "airtable_table_id": "tblERKv4TuOnkYFRS",
    "site_url": "https://swftstudios.github.io/451-heath-listing/",
    "pdf_url": "https://swftstudios.github.io/451-heath-listing/listing-info.pdf",
    "disclaimer": "Presented directly by the owner. All information believed accurate but not warranted. Subject to prior rental."
  },
  "assets": {
    "hero": "hero.jpg",
    "photos": [
      {
        "file": "photo1.jpg",
        "label": "LIVING ROOM",
        "alt": "Spacious living room with large sectional and natural light"
      },
      {
        "file": "photo2.jpg",
        "label": "KITCHEN",
        "alt": "Updated kitchen with granite counters, gas range, and stainless fridge"
      },
      {
        "file": "photo3.jpg",
        "label": "BEDROOM",
        "alt": "King-size bedroom with ceiling fan and ample natural light"
      },
      {
        "file": "photo4.jpg",
        "label": "BATHROOM",
        "alt": "Full bathroom with tub/shower, vanity, and classic black-and-white tile"
      },
      {
        "file": "photo5.jpg",
        "label": "EXTERIOR",
        "alt": "Classic brick building exterior with lush courtyard lawn"
      }
    ]
  },
  "theme": {
    "style": "cream-modern",
    "palette": {
      "ink": "#1c1917",
      "accent": "#d4521e",
      "cream": "#eae7e1",
      "cream_mid": "#f2f0ec",
      "white": "#ffffff",
      "muted": "#78716c",
      "light_ink": "#b4b0aa",
      "faint": "#8c8882"
    }
  }
}
